{
  "schema": "https://ai-atoms.com/schemas/policy-v1.json",
  "type": "policy",
  "id": "policy/ephemeral-vm",
  "version": "1.0.0",
  "name": "Ephemeral VM",
  "description": "Single-use VM destroyed on task completion. Strongest practical isolation for untrusted execution.",
  "subtype": "isolation",
  "effect": "bound",
  "rule": {
    "text": "Single-use VM destroyed on task completion. Strongest practical isolation for untrusted execution.",
    "process": "vm",
    "network": "allowlist",
    "filesystem": "tmpfs",
    "scoped_paths": [
      "/workspace"
    ]
  },
  "authored_by": "convergent-systems-key",
  "source_url": "https://github.com/convergent-systems-co/agent-atoms/blob/main/atoms/isolation-constraint/ephemeral-vm.json",
  "category": "governance",
  "provenance": {
    "source": "convergent-systems-co/agent-atoms",
    "source_url": "https://github.com/convergent-systems-co/agent-atoms/blob/main/atoms/isolation-constraint/ephemeral-vm.json",
    "author": "convergent-systems-co",
    "license": "Apache-2.0",
    "notes": "Re-typed from isolation-constraint by scripts/migrate-policy-tool.py."
  },
  "lifecycle": "stable"
}
