{
  "schema": "https://ai-atoms.com/schemas/policy-v1.json",
  "type": "policy",
  "id": "policy/container-with-allowlist",
  "version": "1.0.0",
  "name": "Container with network allowlist",
  "description": "Container-isolated execution with an allowlist for network egress (e.g., package registries, AI endpoints only). Scoped tmpfs filesystem.",
  "subtype": "isolation",
  "effect": "bound",
  "rule": {
    "text": "Container-isolated execution with an allowlist for network egress (e.g., package registries, AI endpoints only). Scoped tmpfs filesystem.",
    "process": "container",
    "network": "allowlist",
    "filesystem": "scoped",
    "scoped_paths": [
      "/workspace",
      "/tmp"
    ]
  },
  "authored_by": "convergent-systems-key",
  "source_url": "https://github.com/convergent-systems-co/agent-atoms/blob/main/atoms/isolation-constraint/container-with-allowlist.json",
  "category": "governance",
  "provenance": {
    "source": "convergent-systems-co/agent-atoms",
    "source_url": "https://github.com/convergent-systems-co/agent-atoms/blob/main/atoms/isolation-constraint/container-with-allowlist.json",
    "author": "convergent-systems-co",
    "license": "Apache-2.0",
    "notes": "Re-typed from isolation-constraint by scripts/migrate-policy-tool.py."
  },
  "lifecycle": "stable"
}
