{
  "schema": "https://ai-atoms.com/schemas/policy-v1.json",
  "type": "policy",
  "id": "policy/network-namespaced",
  "version": "1.0.0",
  "name": "Network namespaced",
  "description": "Own network namespace with explicit allowlist. Filesystem and process boundaries delegated to the host.",
  "subtype": "isolation",
  "effect": "bound",
  "rule": {
    "text": "Own network namespace with explicit allowlist. Filesystem and process boundaries delegated to the host.",
    "process": "subprocess",
    "network": "allowlist",
    "filesystem": "scoped",
    "scoped_paths": [
      "${WORKSPACE_ROOT}"
    ]
  },
  "authored_by": "convergent-systems-key",
  "source_url": "https://github.com/convergent-systems-co/agent-atoms/blob/main/atoms/isolation-constraint/network-namespaced.json",
  "category": "security",
  "provenance": {
    "source": "convergent-systems-co/agent-atoms",
    "source_url": "https://github.com/convergent-systems-co/agent-atoms/blob/main/atoms/isolation-constraint/network-namespaced.json",
    "author": "convergent-systems-co",
    "license": "Apache-2.0",
    "notes": "Re-typed from isolation-constraint by scripts/migrate-policy-tool.py."
  },
  "lifecycle": "stable"
}
